,sentence_file,sentence,idiomatic_part,ip_start,ip_length,tags
1940,sentence_4839.txt,"Well, you'll have all the time you need to be beautiful this summer and that's what summer is about, for crying out loud.",for crying out loud,101,19,"[0, 0, 0, 0, 0, 0, 0, 0, 0, 0, 0, 0, 0, 0, 0, 0, 0, 0, 0, 1, 1, 1, 1]"
1941,sentence_484.txt,"As far as I'm concerned, community care's dead in the water.",dead in the water,42,17,"[0, 0, 0, 0, 0, 0, 0, 1, 1, 1, 1]"
1942,sentence_4840.txt,"Stick a piece of Christmas tape across the top of the stocking, cut it out and stick it to a folded piece of card.",cut it out,64,10,"[0, 0, 0, 0, 0, 0, 0, 0, 0, 0, 0, 0, 1, 1, 1, 0, 0, 0, 0, 0, 0, 0, 0, 0]"
1943,sentence_485.txt,"When he stands alone in such a place confronted by several police officers, usually some of high rank, the dice are loaded against him, especially as he knows there is no one to corroborate him as to what exactly occurred during the interrogation, how it was conducted and how long it lasted",dice are loaded,107,15,"[0, 0, 0, 0, 0, 0, 0, 0, 0, 0, 0, 0, 0, 0, 0, 0, 0, 0, 0, 1, 1, 1, 0, 0, 0, 0, 0, 0, 0, 0, 0, 0, 0, 0, 0, 0, 0, 0, 0, 0, 0, 0, 0, 0, 0, 0, 0, 0, 0, 0, 0, 0]"
1944,sentence_4853.txt,Give it a rest for several hours after each test.,Give it a rest,0,14,"[1, 1, 1, 1, 0, 0, 0, 0, 0, 0]"
1945,sentence_4863.txt,Tonight you marry Manfro Draper and tomorrow you'll be on your way and good riddance.,good riddance,71,13,"[0, 0, 0, 0, 0, 0, 0, 0, 0, 0, 0, 0, 0, 1, 1]"
1946,sentence_4864.txt,"Because it's a beta version, I don't propose to harp on about any niggles.",harp on,48,7,"[0, 0, 0, 0, 0, 0, 0, 0, 0, 1, 1, 0, 0, 0]"
1947,sentence_4866.txt,A bit hot under the collar.,hot under the collar,6,20,"[0, 0, 1, 1, 1, 1]"
1948,sentence_487.txt,"It was all downhill to the causeway, and the turf was smooth.",all downhill,7,12,"[0, 0, 1, 1, 0, 0, 0, 0, 0, 0, 0, 0]"
1949,sentence_4874.txt,Mind your own business.,Mind your own business,0,22,"[1, 1, 1, 1]"
1950,sentence_4877.txt,"Regularly, up to three times a week, they would rant and rave in the streets.",rant and rave,48,13,"[0, 0, 0, 0, 0, 0, 0, 0, 0, 1, 1, 1, 0, 0, 0]"
1951,sentence_488.txt,But I draw a blank with hazelnuts.,draw a blank,6,12,"[0, 0, 1, 1, 1, 0, 0]"
1952,sentence_4881.txt,Suppose that my private visual experience is strikingly atypical in that systematically I see green where others see red.,see red,113,7,"[0, 0, 0, 0, 0, 0, 0, 0, 0, 0, 0, 0, 0, 0, 0, 0, 0, 1, 1]"
1953,sentence_4885.txt,"It means thinking before you speak, trying hard not to get all steamed up and confrontational.",steamed up,63,10,"[0, 0, 0, 0, 0, 0, 0, 0, 0, 0, 0, 0, 1, 1, 0, 0]"
1954,sentence_4892.txt,"It is going too far to say, cogito.",going too far,6,13,"[0, 0, 1, 1, 1, 0, 0, 0]"
1955,sentence_4894.txt,"Well, it was the last straw.",the last straw,13,14,"[0, 0, 0, 1, 1, 1]"
1956,sentence_49.txt,"It was only a suggestion, Robyn; there's no need to blow a fuse.",blow a fuse,52,11,"[0, 0, 0, 0, 0, 0, 0, 0, 0, 0, 1, 1, 1]"
1957,sentence_4901.txt,"I pretended not to notice it, and, as the students listened with bated breath, instructed them to turn to page thirty in Jespersen.",bated breath,65,12,"[0, 0, 0, 0, 0, 0, 0, 0, 0, 0, 0, 0, 1, 1, 0, 0, 0, 0, 0, 0, 0, 0, 0]"
1958,sentence_491.txt,I'm gon na fall flat on my bum.,fall flat,11,9,"[0, 0, 0, 1, 1, 0, 0, 0]"
1959,sentence_4913.txt,Don't hold your breath waiting for a reply.,hold your breath,6,16,"[0, 1, 1, 1, 0, 0, 0, 0]"
1960,sentence_4919.txt,Styczynski had x-rays after saying that he had pains in his chest and pins and needles in his arms.,pins and needles,70,16,"[0, 0, 0, 0, 0, 0, 0, 0, 0, 0, 0, 0, 0, 1, 1, 1, 0, 0, 0]"
1961,sentence_492.txt,McLeish smiled to himself at the swift fall from grace in the postscript.,fall from grace,39,15,"[0, 0, 0, 0, 0, 0, 0, 1, 1, 1, 0, 0, 0]"
1962,sentence_4923.txt,"Cis, who knew about it, was scared stiff.",scared stiff,28,12,"[0, 0, 0, 0, 0, 0, 1, 1]"
1963,sentence_4938.txt,"The basis for his Scottish policy was his conviction that English safety lay in separating France and Scotland, and that conviction reached fever pitch in 1543.",fever pitch,140,11,"[0, 0, 0, 0, 0, 0, 0, 0, 0, 0, 0, 0, 0, 0, 0, 0, 0, 0, 0, 0, 0, 0, 1, 1, 0, 0]"
1964,sentence_494.txt,It might be a good one and if you could get an appointment as their vet it would be another feather in your cap,feather in your cap,92,19,"[0, 0, 0, 0, 0, 0, 0, 0, 0, 0, 0, 0, 0, 0, 0, 0, 0, 0, 0, 0, 1, 1, 1, 1]"
1965,sentence_4944.txt,Tony Rickardsson is raring to go this season.,raring to go,20,12,"[0, 0, 0, 1, 1, 1, 0, 0]"
1966,sentence_495.txt,"While all her instincts balked against becoming too enmeshed with Vitor, she seemed destined to fight a losing battle.",fight a losing battle,96,21,"[0, 0, 0, 0, 0, 0, 0, 0, 0, 0, 0, 0, 0, 0, 0, 1, 1, 1, 1]"
1967,sentence_4953.txt,One such problem is particularly close to home for many of my Gravesham constituents.,close to home,33,13,"[0, 0, 0, 0, 0, 1, 1, 1, 0, 0, 0, 0, 0, 0]"
1968,sentence_4957.txt,"But, deep down, every Russian knows that our strength is in our unity.",deep down,5,9,"[0, 1, 1, 0, 0, 0, 0, 0, 0, 0, 0, 0, 0]"
1969,sentence_4964.txt,Other critics who could not get worked up about the play also admired the acting.,get worked up,28,13,"[0, 0, 0, 0, 0, 1, 1, 1, 0, 0, 0, 0, 0, 0, 0]"
1970,sentence_4968.txt,"And, though we give you a finish that's as hard as nails, everything is made to a remarkably gentle formulation.",hard as nails,43,13,"[0, 0, 0, 0, 0, 0, 0, 0, 0, 1, 1, 1, 0, 0, 0, 0, 0, 0, 0, 0]"
1971,sentence_4969.txt,They fell head over heels in love and my real Mother returned.,head over heels in love,10,23,"[0, 0, 1, 1, 1, 1, 1, 0, 0, 0, 0, 0]"
1972,sentence_497.txt,Yeah but it's a flash in the pan.,flash in the pan,16,16,"[0, 0, 0, 0, 1, 1, 1, 1]"
1973,sentence_4970.txt,God gave them more than four centuries to show a change of heart.,change of heart,49,15,"[0, 0, 0, 0, 0, 0, 0, 0, 0, 0, 1, 1, 1]"
1974,sentence_4974.txt,"So let's look on the bright side, Mr. Coles.",look on the bright side,9,23,"[0, 0, 1, 1, 1, 1, 1, 0, 0]"
1975,sentence_4979.txt,Leonora digested this peace of news with mixed feelings as he set her on her feet.,mixed feelings,41,14,"[0, 0, 0, 0, 0, 0, 0, 1, 1, 0, 0, 0, 0, 0, 0, 0]"
1976,sentence_4980.txt,There are no hard feelings between ourselves and Camra.,no hard feelings,10,16,"[0, 0, 1, 1, 1, 0, 0, 0, 0]"
1977,sentence_4987.txt,"He was a strong, healthy lad and as pleased as punch to be working with Dad.",pleased as punch,36,16,"[0, 0, 0, 0, 0, 0, 0, 0, 1, 1, 1, 0, 0, 0, 0, 0]"
1978,sentence_499.txt,It was a test that the Three-Ninetieth passed with flying colours destroying thirteen enemy aircraft and achieving excellent bombing results.,with flying colours,46,19,"[0, 0, 0, 0, 0, 0, 0, 0, 1, 1, 1, 0, 0, 0, 0, 0, 0, 0, 0, 0]"
1979,sentence_4995.txt,The car got all steamed up and misty.,steamed up,16,10,"[0, 0, 0, 0, 1, 1, 0, 0]"
1980,sentence_5.txt,"Its rudder and fin were both knocked out, and a four-foot-long gash in the shell meant even repairs on the bank were out of the question.",out of the question,117,19,"[0, 0, 0, 0, 0, 0, 0, 0, 0, 0, 0, 0, 0, 0, 0, 0, 0, 0, 0, 0, 0, 0, 1, 1, 1, 1]"
1981,sentence_50.txt,Blow a gasket.,Blow a gasket,0,13,"[1, 1, 1]"
1982,sentence_500.txt,Another local team off to a flying start are Gloucester Rugby club.,flying start,28,12,"[0, 0, 0, 0, 0, 0, 1, 1, 0, 0, 0, 0]"
1983,sentence_5006.txt,"For the remainder of the carol I was on tenterhooks, not daring to take my eyes from the lectern.",on tenterhooks,37,14,"[0, 0, 0, 0, 0, 0, 0, 0, 1, 1, 0, 0, 0, 0, 0, 0, 0, 0, 0]"
1984,sentence_501.txt,This is a fool 's errand.,fool 's errand,10,14,"[0, 0, 0, 1, 1, 1]"
1985,sentence_5012.txt,"He grasped her suddenly nerveless fingers in his hand, sending her a smile with enough voltage to make her weak at the knees.",weak at the knees,107,17,"[0, 0, 0, 0, 0, 0, 0, 0, 0, 0, 0, 0, 0, 0, 0, 0, 0, 0, 0, 1, 1, 1, 1]"
1986,sentence_502.txt,You know I don't like him having a foot in the door here.,foot in the door,35,16,"[0, 0, 0, 0, 0, 0, 0, 0, 1, 1, 1, 1, 0]"
1987,sentence_5021.txt,Soon it was dark and the Christmas evening was in full swing.,in full swing,47,13,"[0, 0, 0, 0, 0, 0, 0, 0, 0, 1, 1, 1]"
1988,sentence_503.txt,If they can get a foothold in Europe they will have the chance to be bigger and better.,get a foothold,12,14,"[0, 0, 0, 1, 1, 1, 0, 0, 0, 0, 0, 0, 0, 0, 0, 0, 0, 0]"
1989,sentence_5039.txt,"Come on, girl, take it easy.",take it easy,15,12,"[0, 0, 0, 1, 1, 1]"
1990,sentence_504.txt,Aunt May is only the front runner.,front runner,21,12,"[0, 0, 0, 0, 0, 1, 1]"
1991,sentence_5046.txt,The market is down in the dumps.,down in the dumps,14,17,"[0, 0, 0, 1, 1, 1, 1]"
1992,sentence_505.txt,But you haven't to let either of them get the better of you.,get the better of you,38,21,"[0, 0, 0, 0, 0, 0, 0, 0, 1, 1, 1, 1, 1]"
1993,sentence_506.txt,If the money was ploughed back into dog racing  tracks could improve amenities and strengthen security which would encourage more people to go to the dogs.,go to the dogs,140,14,"[0, 0, 0, 0, 0, 0, 0, 0, 0, 0, 0, 0, 0, 0, 0, 0, 0, 0, 0, 0, 0, 0, 0, 1, 1, 1, 1]"
1994,sentence_5062.txt,Eva was over the moon.,over the moon,8,13,"[0, 0, 1, 1, 1]"
1995,sentence_5066.txt,My good friends of masher persuasion are in seventh heaven when they have the opportunity of admiring eight pretty faces.,in seventh heaven,41,17,"[0, 0, 0, 0, 0, 0, 0, 1, 1, 1, 0, 0, 0, 0, 0, 0, 0, 0, 0, 0]"
1996,sentence_5068.txt,"Going Live host Phillip, 30, popped the question yesterday and was' thrilled to bits' when 28-year-old Stephanie said yes.",thrilled to bits,68,16,"[0, 0, 0, 0, 0, 0, 0, 0, 0, 0, 0, 1, 1, 1, 0, 0, 0, 0, 0]"
1997,sentence_5071.txt,"Set in extensive gardens, the staff at the Sauerhof go out of their way to make visitors welcome, and with the superb health, fitness and beauty programmes on offer, you're sure to leave feeling on top of the world.",on top of the world,195,19,"[0, 0, 0, 0, 0, 0, 0, 0, 0, 0, 0, 0, 0, 0, 0, 0, 0, 0, 0, 0, 0, 0, 0, 0, 0, 0, 0, 0, 0, 0, 0, 0, 0, 0, 1, 1, 1, 1, 1]"
1998,sentence_5072.txt,Most couples feel they are walking on air on their wedding day but for Sellafield's Zoe Whittle and Terry Madrick it was more than just imagination.,walking on air,27,14,"[0, 0, 0, 0, 0, 1, 1, 1, 0, 0, 0, 0, 0, 0, 0, 0, 0, 0, 0, 0, 0, 0, 0, 0, 0, 0]"
1999,sentence_5075.txt,"I go bananas, I go spare, I go for you in a big way, I go for you with a knife.",go bananas,2,10,"[0, 1, 1, 0, 0, 0, 0, 0, 0, 0, 0, 0, 0, 0, 0, 0, 0, 0, 0, 0, 0]"
2000,sentence_5075.txt,"I go bananas, I go spare, I go for you in a big way, I go for you with a knife.",go spare,16,8,"[0, 0, 0, 0, 1, 1, 0, 0, 0, 0, 0, 0, 0, 0, 0, 0, 0, 0, 0, 0, 0]"
2001,sentence_5082.txt,Of course that's not all there is to this beautiful island.,not all there,17,13,"[0, 0, 0, 1, 1, 1, 0, 0, 0, 0, 0]"
2002,sentence_509.txt,"Erm, should the house go up in smoke, Theresa across the road run to her.",go up in smoke,22,14,"[0, 0, 0, 0, 1, 1, 1, 1, 0, 0, 0, 0, 0, 0, 0]"
2003,sentence_5095.txt,Will the Secretary of State for Scotland have to eat humble pie again or will he stand up for Scotland and make this a resignation issue?,eat humble pie,49,14,"[0, 0, 0, 0, 0, 0, 0, 0, 0, 1, 1, 1, 0, 0, 0, 0, 0, 0, 0, 0, 0, 0, 0, 0, 0, 0]"
2004,sentence_51.txt,"If you blow your top, they'll nick you double quick.",blow your top,7,13,"[0, 0, 1, 1, 1, 0, 0, 0, 0, 0]"
2005,sentence_510.txt,"Because your dad's a manager, he's got it made.",got it made,35,11,"[0, 0, 0, 0, 0, 0, 1, 1, 1]"
2006,sentence_5103.txt,"The manual alternative, in which you have to switch from record mode to play, and then check to find the end of the previous recording by trial and error before returning to record mode, is messy, time-consuming and wasteful of precious battery-time.",trial and error,138,15,"[0, 0, 0, 0, 0, 0, 0, 0, 0, 0, 0, 0, 0, 0, 0, 0, 0, 0, 0, 0, 0, 0, 0, 0, 0, 0, 1, 1, 1, 0, 0, 0, 0, 0, 0, 0, 0, 0, 0, 0, 0, 0]"
2007,sentence_5104.txt,"Members wishing to express an opinion in the debate later this afternoon, any suggestion that the additional two hours provided is adequate is clearly wide of the mark?",wide of the mark,151,16,"[0, 0, 0, 0, 0, 0, 0, 0, 0, 0, 0, 0, 0, 0, 0, 0, 0, 0, 0, 0, 0, 0, 0, 0, 1, 1, 1, 1]"
2008,sentence_5107.txt,"We were trying to diverse the music with the mixture of soul and reggae, though it wasn't really the done thing at that point.",the done thing,97,14,"[0, 0, 0, 0, 0, 0, 0, 0, 0, 0, 0, 0, 0, 0, 0, 0, 0, 0, 1, 1, 1, 0, 0, 0]"
2009,sentence_5110.txt,Kenny Schaefer aims to gatecrash the world's top ten by beating York's Commonwealth supermiddleweight champion Henry Wharton on Thursday.,gatecrash,23,9,"[0, 0, 0, 0, 1, 0, 0, 0, 0, 0, 0, 0, 0, 0, 0, 0, 0, 0, 0]"
2010,sentence_5118.txt,"Venus fly trap, who've just released their latest' Achilles Heel' single on Danceteria.",Achilles Heel,51,13,"[0, 0, 0, 0, 0, 0, 0, 0, 1, 1, 0, 0, 0]"
2011,sentence_5119.txt,Careful study of this sent alarm bells ringing throughout vast areas of southern and eastern England.,alarm bells ringing,27,19,"[0, 0, 0, 0, 0, 1, 1, 1, 0, 0, 0, 0, 0, 0, 0, 0]"
2012,sentence_512.txt,The great creature fell on its knees in the snow.,on its knees,24,12,"[0, 0, 0, 0, 1, 1, 1, 0, 0, 0]"
2013,sentence_5120.txt,It's simply asking for trouble.,asking for trouble,12,18,"[0, 0, 1, 1, 1]"
2014,sentence_5121.txt,Turn around and jump back to the wall.,back to the wall,21,16,"[0, 0, 0, 0, 1, 1, 1, 1]"
2015,sentence_5129.txt,"Unfortunately, a Catch 22 comes into play here.",Catch 22,17,8,"[0, 0, 1, 1, 0, 0, 0, 0]"
2016,sentence_513.txt,For months the polls have been predicting an unprecedented landslide victory for the Right in next month's general election.,landslide victory,59,17,"[0, 0, 0, 0, 0, 0, 0, 0, 0, 1, 1, 0, 0, 0, 0, 0, 0, 0, 0]"
2017,sentence_514.txt,Halliwell said that these sexual experiments can only lead to a dead end.,lead to a dead end,54,18,"[0, 0, 0, 0, 0, 0, 0, 0, 1, 1, 1, 1, 1]"
2018,sentence_5142.txt,The only way to get to the bottom of it is to confront the chairman.,get to the bottom of,16,20,"[0, 0, 0, 0, 1, 1, 1, 1, 1, 0, 0, 0, 0, 0, 0]"
2019,sentence_5149.txt,"Soon after it was built, it was left high and dry by a storm and thereafter was used as a signalling tower by Blandy's.",high and dry,37,12,"[0, 0, 0, 0, 0, 0, 0, 0, 1, 1, 1, 0, 0, 0, 0, 0, 0, 0, 0, 0, 0, 0, 0, 0]"
2020,sentence_515.txt,Whereas before we were going up in leaps and bounds.,leaps and bounds,35,16,"[0, 0, 0, 0, 0, 0, 0, 1, 1, 1]"
2021,sentence_5151.txt,They have fled the field and left their constituents in the lurch,in the lurch,53,12,"[0, 0, 0, 0, 0, 0, 0, 0, 0, 1, 1, 1]"
2022,sentence_5154.txt,"It means that when pesticides are used, and it is only as a last resort, then the most environmentally friendly are chosen.",last resort,60,11,"[0, 0, 0, 0, 0, 0, 0, 0, 0, 0, 0, 0, 0, 1, 1, 0, 0, 0, 0, 0, 0, 0]"
2023,sentence_5164.txt,It is not enough for the Minister to pass the buck to the chief inspector of constabulary.,pass the buck,37,13,"[0, 0, 0, 0, 0, 0, 0, 0, 1, 1, 1, 0, 0, 0, 0, 0, 0]"
2024,sentence_5166.txt,I do not believe that there is a quick fix for the coal industry.,quick fix,33,9,"[0, 0, 0, 0, 0, 0, 0, 0, 1, 1, 0, 0, 0, 0]"
2025,sentence_517.txt,"I reluctantly withdraw this motion, but I will say this, we live to fight another day.",live to fight another day,60,25,"[0, 0, 0, 0, 0, 0, 0, 0, 0, 0, 0, 1, 1, 1, 1, 1]"
2026,sentence_5177.txt,This is the major stumbling block to experimental realisation of the Lorenz system in lasers.,stumbling block,18,15,"[0, 0, 0, 0, 1, 1, 0, 0, 0, 0, 0, 0, 0, 0, 0]"
2027,sentence_518.txt,Joe and I mean I come a long way,come a long way,17,15,"[0, 0, 0, 0, 0, 1, 1, 1, 1]"
2028,sentence_5182.txt,The taxation of disturbance allowances is a particularly thorny issue.,thorny issue,57,12,"[0, 0, 0, 0, 0, 0, 0, 0, 1, 1]"
2029,sentence_5187.txt,That kind of farce was just the tip of the iceberg.,tip of the iceberg,32,18,"[0, 0, 0, 0, 0, 0, 0, 1, 1, 1, 1]"
2030,sentence_519.txt,If you find yourself at a low ebb this weekend don't worry.,at a low ebb,21,12,"[0, 0, 0, 0, 1, 1, 1, 1, 0, 0, 0, 0]"
2031,sentence_5192.txt,"The thing is, it's a vicious circle, it's Catch 22 really.",vicious circle,21,14,"[0, 0, 0, 0, 0, 1, 1, 0, 0, 0, 0]"
2032,sentence_5192.txt,"The thing is, it's a vicious circle, it's Catch 22 really.",Catch 22,42,8,"[0, 0, 0, 0, 0, 0, 0, 0, 1, 1, 0]"
2033,sentence_5195.txt,"Superintendent Huddleston noted with evident self-satisfaction that everything worked without a hitch, and there was not a single accident of any kind.",without a hitch,86,15,"[0, 0, 0, 0, 0, 0, 0, 0, 0, 1, 1, 1, 0, 0, 0, 0, 0, 0, 0, 0, 0, 0]"
2034,sentence_5198.txt,"When the future seems to be filled with storm clouds, it may appear that the Church has no other recourse but to batten down the hatches and attempt to ride the storm.",batten down the hatches,113,23,"[0, 0, 0, 0, 0, 0, 0, 0, 0, 0, 0, 0, 0, 0, 0, 0, 0, 0, 0, 0, 0, 0, 1, 1, 1, 1, 0, 0, 0, 0, 0, 0]"
2035,sentence_5199.txt,I was determined to take a calculated risk.,calculated risk,27,15,"[0, 0, 0, 0, 0, 0, 1, 1]"
2036,sentence_52.txt,"Dear Father Christmas, I have a bone to pick with you.",bone to pick,32,12,"[0, 0, 0, 0, 0, 0, 1, 1, 1, 0, 0]"
2037,sentence_520.txt,The station which persuaded him to make a comeback says it can't believe its luck.,make a comeback,35,15,"[0, 0, 0, 0, 0, 0, 1, 1, 1, 0, 0, 0, 0, 0, 0]"
2038,sentence_5201.txt,A close shave in the post room.,close shave,2,11,"[0, 1, 1, 0, 0, 0, 0]"
2039,sentence_5206.txt,One false move and you're dead.,false move,4,10,"[0, 1, 1, 0, 0, 0]"
2040,sentence_5207.txt,"This is another high scoring technique, though its use is fraught with danger.",fraught with danger,58,19,"[0, 0, 0, 0, 0, 0, 0, 0, 0, 0, 1, 1, 1]"
2041,sentence_521.txt,Why did you make the cut worse?,make the cut,12,12,"[0, 0, 0, 1, 1, 1, 0]"
2042,sentence_5213.txt,"When the kick is delivered, the defender ducks beneath it, well out of harm 's way.",out of harm 's way,64,18,"[0, 0, 0, 0, 0, 0, 0, 0, 0, 0, 0, 1, 1, 1, 1, 1]"
2043,sentence_5218.txt,"Clearly, the British people know when the policy is in safe hands.",in safe hands,52,13,"[0, 0, 0, 0, 0, 0, 0, 0, 0, 1, 1, 1]"
2044,sentence_5219.txt,"She says do not worry, but it's wiser to be on the safe side.",on the safe side,44,16,"[0, 0, 0, 0, 0, 0, 0, 0, 0, 0, 1, 1, 1, 1]"
2045,sentence_522.txt,They therefore faced no option other than to make a go of the business.,make a go of,45,12,"[0, 0, 0, 0, 0, 0, 0, 0, 1, 1, 1, 1, 0, 0]"
2046,sentence_5223.txt,"There is, we might say, a general interest at stake here.",at stake,43,8,"[0, 0, 0, 0, 0, 0, 0, 0, 1, 1, 0]"
2047,sentence_5224.txt,"Take cover, here comes Attila.",Take cover,0,10,"[1, 1, 0, 0, 0]"
2048,sentence_5226.txt,"Now watch your step, the path gets a bit steep further down.",watch your step,4,15,"[0, 1, 1, 1, 0, 0, 0, 0, 0, 0, 0, 0]"
2049,sentence_523.txt,It was a bit like the rowing boat trying to make headway against the flow of the river near the weir.,make headway,44,12,"[0, 0, 0, 0, 0, 0, 0, 0, 0, 0, 1, 1, 0, 0, 0, 0, 0, 0, 0, 0, 0]"
2050,sentence_5233.txt,You'll need to lie in or you'll be too exhausted to have any fun.,lie in,15,6,"[0, 0, 0, 1, 1, 0, 0, 0, 0, 0, 0, 0, 0, 0]"
2051,sentence_5234.txt,"Shift the cattle, work the horses, stick and ball, come back for lunch, an hour's siesta, and you go out like a light I can tell you, then we play chukkas in the afternoon.",out like a light,101,16,"[0, 0, 0, 0, 0, 0, 0, 0, 0, 0, 0, 0, 0, 0, 0, 0, 0, 0, 0, 1, 1, 1, 1, 0, 0, 0, 0, 0, 0, 0, 0, 0, 0, 0]"
2052,sentence_524.txt,"We know that as soon as we try and make inroads into that it, it would absolutely mushroom.",make inroads,35,12,"[0, 0, 0, 0, 0, 0, 0, 0, 0, 1, 1, 0, 0, 0, 0, 0, 0, 0]"
2053,sentence_5240.txt,"A sleeping partner is a person who contributes capital to a business, and receives a share of the profits, but takes no active part in running the business.",sleeping partner,2,16,"[0, 1, 1, 0, 0, 0, 0, 0, 0, 0, 0, 0, 0, 0, 0, 0, 0, 0, 0, 0, 0, 0, 0, 0, 0, 0, 0, 0]"
2054,sentence_5245.txt,"There is no need to go back to square one, just a few steps backward is all that is needed.",back to square one,23,18,"[0, 0, 0, 0, 0, 0, 1, 1, 1, 1, 0, 0, 0, 0, 0, 0, 0, 0, 0, 0]"
2055,sentence_5246.txt,Glenavon are on the march again with a Gold Cup quarter-final place in the bag.,in the bag,68,10,"[0, 0, 0, 0, 0, 0, 0, 0, 0, 0, 0, 0, 1, 1, 1]"
2056,sentence_5247.txt,Surely some of it will bear fruit.,bear fruit,23,10,"[0, 0, 0, 0, 0, 1, 1]"
2057,sentence_5249.txt,Virgin is teaming up with Blockbuster International to set up a chain of international mega-stores.,Blockbuster,26,11,"[0, 0, 0, 0, 0, 1, 0, 0, 0, 0, 0, 0, 0, 0, 0]"
2058,sentence_525.txt,He says he's really going to make a killing.,make a killing,29,14,"[0, 0, 0, 0, 0, 0, 1, 1, 1]"
2059,sentence_5257.txt,It is not unknown for so-called' unspinnable' aircraft to come to grief by getting into a stable spin,come to grief,58,13,"[0, 0, 0, 0, 0, 0, 0, 0, 0, 1, 1, 1, 0, 0, 0, 0, 0, 0]"
2060,sentence_526.txt,"Right, they're the make or break areas which comprise your job.",make or break,19,13,"[0, 0, 0, 1, 1, 1, 0, 0, 0, 0, 0]"
2061,sentence_5262.txt,England swept aside defending champions Ireland at Hoylake yesterday to stay on course for their first men's amateur Home International title for four years.,on course for,77,13,"[0, 0, 0, 0, 0, 0, 0, 0, 0, 0, 0, 1, 1, 1, 0, 0, 0, 0, 0, 0, 0, 0, 0, 0]"
2062,sentence_5267.txt,No one can make a dead duck go' quack' any more than a dead person can be made to speak,dead duck,18,9,"[0, 0, 0, 0, 0, 1, 1, 0, 0, 0, 0, 0, 0, 0, 0, 0, 0, 0, 0, 0]"
2063,sentence_5275.txt,It is also a nation waiting for her to fall flat on her face.,fall flat,39,9,"[0, 0, 0, 0, 0, 0, 0, 0, 0, 1, 1, 0, 0, 0]"
2064,sentence_5276.txt,The competition was soon simplified with the fall from grace of William Craig.,fall from grace,45,15,"[0, 0, 0, 0, 0, 0, 0, 1, 1, 1, 0, 0, 0]"
2065,sentence_528.txt,"Multiples such as W.H. Smith will certainly not miss the boat but the more traditional, book-focused groups may not even know there is a boat.",miss the boat,48,13,"[0, 0, 0, 0, 0, 0, 0, 0, 1, 1, 1, 0, 0, 0, 0, 0, 0, 0, 0, 0, 0, 0, 0, 0, 0]"
2066,sentence_5283.txt,I had a trial pouring and the teapot passed with flying colours.,with flying colours,44,19,"[0, 0, 0, 0, 0, 0, 0, 0, 0, 1, 1, 1]"
2067,sentence_5284.txt,Asitz double chair lift operates on Wednesdays and Sundays during high summer to give a flying start to some of the area's prettiest walks.,flying start,88,12,"[0, 0, 0, 0, 0, 0, 0, 0, 0, 0, 0, 0, 0, 0, 0, 1, 1, 0, 0, 0, 0, 0, 0, 0]"
2068,sentence_529.txt,"Is this the moment of truth, he wrote, or the greatest temptation?",moment of truth,12,15,"[0, 0, 0, 1, 1, 1, 0, 0, 0, 0, 0, 0]"
2069,sentence_5294.txt,"Beatty thinks he's got it made, but she turns to Jack.",got it made,19,11,"[0, 0, 0, 1, 1, 1, 0, 0, 0, 0, 0]"
2070,sentence_5299.txt,Existing industries expanded in leaps and bounds.,leaps and bounds,32,16,"[0, 0, 0, 0, 1, 1, 1]"
2071,sentence_53.txt,"You sound cheesed off, what's the matter?",cheesed off,10,11,"[0, 0, 1, 1, 0, 0, 0]"
2072,sentence_5302.txt,We have come a long way since the idealism of Lord Devlin,come a long way,8,15,"[0, 0, 1, 1, 1, 1, 0, 0, 0, 0, 0, 0]"
2073,sentence_5306.txt,"If he can't make a go of them, nobody can.",make a go of,12,12,"[0, 0, 0, 1, 1, 1, 1, 0, 0, 0]"
2074,sentence_531.txt,Erm you probably all know Murphy 's law that what can go wrong will go wrong.,Murphy 's law,26,13,"[0, 0, 0, 0, 0, 1, 1, 1, 0, 0, 0, 0, 0, 0, 0, 0]"
2075,sentence_5310.txt,"This and the social side, if any, is what can make or break a holiday.",make or break,46,13,"[0, 0, 0, 0, 0, 0, 0, 0, 0, 0, 1, 1, 1, 0, 0]"
2076,sentence_5313.txt,Australia made inroads into our batting and the moment of truth arrived when Fletch had to go out and bat.,made inroads,10,12,"[0, 1, 1, 0, 0, 0, 0, 0, 0, 0, 0, 0, 0, 0, 0, 0, 0, 0, 0, 0]"
2077,sentence_5313.txt,Australia made inroads into our batting and the moment of truth arrived when Fletch had to go out and bat.,moment of truth,48,15,"[0, 0, 0, 0, 0, 0, 0, 0, 1, 1, 1, 0, 0, 0, 0, 0, 0, 0, 0, 0]"
2078,sentence_5319.txt,"What God has done fades slowly out of the picture, and we focus increasingly on what we ourselves seem well able to do.",out of the picture,31,18,"[0, 0, 0, 0, 0, 0, 1, 1, 1, 1, 0, 0, 0, 0, 0, 0, 0, 0, 0, 0, 0, 0, 0]"
2079,sentence_532.txt,I'm not getting anywhere my legs aren't long enough,not getting anywhere,4,20,"[0, 1, 1, 1, 0, 0, 0, 0, 0]"
2080,sentence_5321.txt,We are comfortable and I could pack it in tomorrow.,pack it in,31,10,"[0, 0, 0, 0, 0, 0, 1, 1, 1, 0]"
2081,sentence_5327.txt,I used the analogy of a family that goes from rags to riches and back to rags in three or four generations.,rags to riches,46,14,"[0, 0, 0, 0, 0, 0, 0, 0, 0, 0, 1, 1, 1, 0, 0, 0, 0, 0, 0, 0, 0, 0]"
2082,sentence_5328.txt,Central bankers are riding high.,riding high,20,11,"[0, 0, 0, 1, 1]"
2083,sentence_5329.txt,Sandy is a knight who does not fail to rise to the occasion.,rise to the occasion,39,20,"[0, 0, 0, 0, 0, 0, 0, 0, 0, 1, 1, 1, 1]"
2084,sentence_533.txt,You say nothing succeeds like success and number seventeen is success and how do you spell success.,nothing succeeds like success,8,29,"[0, 0, 1, 1, 1, 1, 0, 0, 0, 0, 0, 0, 0, 0, 0, 0, 0]"
2085,sentence_5331.txt,The imaginary central point in the sail through which the power of the sail acts.,sail through,35,12,"[0, 0, 0, 0, 0, 0, 1, 1, 0, 0, 0, 0, 0, 0, 0]"
2086,sentence_5332.txt,"Also, there are situations in which it could well save the day.",save the day,50,12,"[0, 0, 0, 0, 0, 0, 0, 0, 0, 1, 1, 1]"
2087,sentence_5333.txt,You either sink or swim.,sink or swim,11,12,"[0, 0, 1, 1, 1]"
2088,sentence_5335.txt,It may not be the London Palladium but it is a smash hit.,smash hit,47,9,"[0, 0, 0, 0, 0, 0, 0, 0, 0, 0, 0, 1, 1]"
