,sentence_file,sentence,idiomatic_part,ip_start,ip_length,tags
1234,sentence_3033.txt,I ought to call your bluff.,call your bluff,11,15,"[0, 0, 0, 1, 1, 1]"
1235,sentence_3034.txt,"After all, football left leather behind long ago, but I expect cricketers will be up in arms about this suggestion",up in arms,82,10,"[0, 0, 0, 0, 0, 0, 0, 0, 0, 0, 0, 0, 0, 0, 1, 1, 1, 0, 0, 0]"
1236,sentence_3035.txt,Now will you please get off my back.,get off my back,20,15,"[0, 0, 0, 0, 1, 1, 1, 1]"
1237,sentence_3038.txt,"His earlier black mood, the brooding silences, seemed to be at an end.",black mood,12,10,"[0, 0, 1, 1, 0, 0, 0, 0, 0, 0, 0, 0, 0]"
1238,sentence_304.txt,I swear you have a screw loose.,screw loose,19,11,"[0, 0, 0, 0, 0, 1, 1]"
1239,sentence_3043.txt,However I did get a bit cheesed off with the movie's rather plodding pace.,cheesed off,24,11,"[0, 0, 0, 0, 0, 0, 1, 1, 0, 0, 0, 0, 0, 0]"
1240,sentence_3045.txt,"Wake up, Cati, for crying out loud.",for crying out loud,15,19,"[0, 0, 0, 1, 1, 1, 1]"
1241,sentence_3046.txt,"We must cut it out, before it spreads.",cut it out,8,10,"[0, 0, 1, 1, 1, 0, 0, 0]"
1242,sentence_305.txt,I must have gone stark raving mad.,stark raving mad,17,16,"[0, 0, 0, 0, 1, 1, 1]"
1243,sentence_3055.txt,"Yeah, yeah, don't get your knickers in a twist, it's in one piece.",get your knickers in a twist,18,28,"[0, 0, 0, 1, 1, 1, 1, 1, 1, 0, 0, 0, 0]"
1244,sentence_3059.txt,"Dolan, in the meantime, has been told to give it a rest otherwise the upcoming European tour will have to be called off.",give it a rest,41,14,"[0, 0, 0, 0, 0, 0, 0, 0, 1, 1, 1, 1, 0, 0, 0, 0, 0, 0, 0, 0, 0, 0, 0]"
1245,sentence_306.txt,"I'm gonna get stir crazy not being able to play badminton I know, and I score, it's gonna drive me crazy.",stir crazy,14,10,"[0, 0, 0, 1, 1, 0, 0, 0, 0, 0, 0, 0, 0, 0, 0, 0, 0, 0, 0, 0, 0]"
1246,sentence_3068.txt,The share price should go through the roof.,go through the roof,23,19,"[0, 0, 0, 0, 1, 1, 1, 1]"
1247,sentence_3069.txt,Its supporters are having a good riddance to Quebec attitude which must be purged.,good riddance,28,13,"[0, 0, 0, 0, 0, 1, 1, 0, 0, 0, 0, 0, 0, 0]"
1248,sentence_3070.txt,But the Tories would be unwise to harp on about Mr Kinnock's.,harp on,34,7,"[0, 0, 0, 0, 0, 0, 0, 1, 1, 0, 0, 0]"
1249,sentence_3072.txt,The reviewer is likely to get hot under the collar if a personal favourite has been left out and can easily end up merely drawing up a rival selection.,hot under the collar,30,20,"[0, 0, 0, 0, 0, 0, 1, 1, 1, 1, 0, 0, 0, 0, 0, 0, 0, 0, 0, 0, 0, 0, 0, 0, 0, 0, 0, 0, 0]"
1250,sentence_3080.txt,"Mind your own business, is going to be a very tiring day.",Mind your own business,0,22,"[1, 1, 1, 1, 0, 0, 0, 0, 0, 0, 0, 0]"
1251,sentence_3083.txt,This time there was no Balestre to rant and rave.,rant and rave,35,13,"[0, 0, 0, 0, 0, 0, 0, 1, 1, 1]"
1252,sentence_3087.txt,Black outlook is making us see red.,see red,27,7,"[0, 0, 0, 0, 0, 1, 1]"
1253,sentence_3088.txt,"Make no mistake, Wright's short fuse is a serious business and if Graham is to lose a top player through suspension, on top of all the headlines on his ill-discipline, the Arsenal manager may soon wonder if he is worth the trouble.",short fuse,26,10,"[0, 0, 0, 0, 1, 1, 0, 0, 0, 0, 0, 0, 0, 0, 0, 0, 0, 0, 0, 0, 0, 0, 0, 0, 0, 0, 0, 0, 0, 0, 0, 0, 0, 0, 0, 0, 0, 0, 0, 0, 0, 0]"
1254,sentence_3091.txt,Mark said that when the Raja saw the damage he was wearing glasses which steamed up a bit.,steamed up,73,10,"[0, 0, 0, 0, 0, 0, 0, 0, 0, 0, 0, 0, 0, 0, 1, 1, 0, 0]"
1255,sentence_3098.txt,"Scathach had impaled it from behind, the point going too far and penetrating Tallis.",going too far,47,13,"[0, 0, 0, 0, 0, 0, 0, 0, 1, 1, 1, 0, 0, 0]"
1256,sentence_31.txt,"For a brother and sister act, there was certainly no love lost between them.",no love lost,50,12,"[0, 0, 0, 0, 0, 0, 0, 0, 0, 1, 1, 1, 0, 0]"
1257,sentence_310.txt,"It may well be necessary to botch up repairs using hurdles, bedsteads, corrugated iron sheets, scraps of wire netting, and baler twine.",botch up,28,8,"[0, 0, 0, 0, 0, 0, 1, 1, 0, 0, 0, 0, 0, 0, 0, 0, 0, 0, 0, 0, 0, 0]"
1258,sentence_3100.txt,"The small independent bakers, already affected by the supermarket bakeries, see this as the last straw.",the last straw,88,14,"[0, 0, 0, 0, 0, 0, 0, 0, 0, 0, 0, 0, 0, 1, 1, 1]"
1259,sentence_3107.txt,Bated breath leads to web of intrigue.,Bated breath,0,12,"[1, 1, 0, 0, 0, 0, 0]"
1260,sentence_3119.txt,Don't hold your breath.,hold your breath,6,16,"[0, 1, 1, 1]"
1261,sentence_312.txt,"It is now time, however, that I eat my words.",eat my words,32,12,"[0, 0, 0, 0, 0, 0, 0, 1, 1, 1]"
1262,sentence_3124.txt,Nerves of steel help if you want to be successful in media buying.,Nerves of steel,0,15,"[1, 1, 1, 0, 0, 0, 0, 0, 0, 0, 0, 0, 0]"
1263,sentence_3125.txt,"My head roared with neon pins and needles, at once visual and sensual.",pins and needles,25,16,"[0, 0, 0, 0, 0, 1, 1, 1, 0, 0, 0, 0, 0]"
1264,sentence_3129.txt,He was very naturally scared stiff of using up all his remaining petrol and making a bad landing.,scared stiff,22,12,"[0, 0, 0, 0, 1, 1, 0, 0, 0, 0, 0, 0, 0, 0, 0, 0, 0, 0]"
1265,sentence_313.txt,Freudian slip there.,Freudian slip,0,13,"[1, 1, 0]"
1266,sentence_3131.txt,"Louis was reconstituting the royal family, keeping his adult sons on tenterhooks.",on tenterhooks,66,14,"[0, 0, 0, 0, 0, 0, 0, 0, 0, 0, 1, 1]"
1267,sentence_3144.txt,Speculation about his Leeds' future reached fever pitch when he was not even on the bench for last week's Coca-Cola Cup tie at Scunthorpe.,fever pitch,44,11,"[0, 0, 0, 0, 0, 0, 1, 1, 0, 0, 0, 0, 0, 0, 0, 0, 0, 0, 0, 0, 0, 0, 0, 0]"
1268,sentence_3147.txt,"McAllister turned off the gas ring, blew out the match, and walked to the front door, grumbling to herself, hold your horses, I'm coming, I'm coming, when another urgent series of knocks sounded.",hold your horses,108,16,"[0, 0, 0, 0, 0, 0, 0, 0, 0, 0, 0, 0, 0, 0, 0, 0, 0, 0, 0, 1, 1, 1, 0, 0, 0, 0, 0, 0, 0, 0, 0, 0, 0]"
1269,sentence_3150.txt,I've kept myself fit and I was raring to go.,raring to go,31,12,"[0, 0, 0, 0, 0, 0, 0, 1, 1, 1]"
1270,sentence_3152.txt,"It was depressing to think of Sien and the children he had left to fend for themselves, depressing too to remember that Theo was having to bear the brunt of his trouble as always.",bear the brunt,139,14,"[0, 0, 0, 0, 0, 0, 0, 0, 0, 0, 0, 0, 0, 0, 0, 0, 0, 0, 0, 0, 0, 0, 0, 0, 0, 0, 1, 1, 1, 0, 0, 0, 0, 0]"
1271,sentence_3155.txt,"The thing with Minneapolis was that everyone was bored to tears, so we just made a scene.",bored to tears,49,14,"[0, 0, 0, 0, 0, 0, 0, 0, 1, 1, 1, 0, 0, 0, 0, 0, 0]"
1272,sentence_3159.txt,"It is important, however, to have a source of money close to home.",close to home,52,13,"[0, 0, 0, 0, 0, 0, 0, 0, 0, 0, 1, 1, 1]"
1273,sentence_3163.txt,"Deep down inside, you see, I still believed that life was basically benevolent.",Deep down,0,9,"[1, 1, 0, 0, 0, 0, 0, 0, 0, 0, 0, 0, 0]"
1274,sentence_3164.txt,But the senior bankers are fish out of water when it comes to international lending.,fish out of water,27,17,"[0, 0, 0, 0, 0, 1, 1, 1, 1, 0, 0, 0, 0, 0, 0]"
1275,sentence_317.txt,"Come clean Steve, swallow your pride.",swallow your pride,18,18,"[0, 0, 0, 1, 1, 1]"
1276,sentence_3170.txt,Now don't get worked up again.,get worked up,10,13,"[0, 0, 1, 1, 1, 0]"
1277,sentence_3171.txt,Mr. Stevenson is not gone a week and you all go to pieces.,go to pieces,45,12,"[0, 0, 0, 0, 0, 0, 0, 0, 0, 0, 1, 1, 1]"
1278,sentence_3174.txt,He's as hard as nails.,hard as nails,8,13,"[0, 0, 1, 1, 1]"
1279,sentence_3175.txt,"We met, fell head over heels in love in a shockingly short time, and were still in love thirty years.",head over heels in love,13,23,"[0, 0, 0, 1, 1, 1, 1, 1, 0, 0, 0, 0, 0, 0, 0, 0, 0, 0, 0, 0]"
1280,sentence_3176.txt,I hope this Tory government's change of heart is genuine and that they are not just trying to pass the buck.,change of heart,30,15,"[0, 0, 0, 0, 0, 1, 1, 1, 0, 0, 0, 0, 0, 0, 0, 0, 0, 0, 0, 0, 0]"
1281,sentence_3176.txt,I hope this Tory government's change of heart is genuine and that they are not just trying to pass the buck.,pass the buck,94,13,"[0, 0, 0, 0, 0, 0, 0, 0, 0, 0, 0, 0, 0, 0, 0, 0, 0, 0, 1, 1, 1]"
1282,sentence_3180.txt,"Anyway, let's look on the bright side.",look on the bright side,14,23,"[0, 0, 1, 1, 1, 1, 1]"
1283,sentence_3185.txt,"Seeing it, Tolonen had mixed feelings.",mixed feelings,23,14,"[0, 0, 0, 0, 1, 1]"
1284,sentence_3186.txt,I have no hard feelings towards Steve.,no hard feelings,7,16,"[0, 0, 1, 1, 1, 0, 0]"
1285,sentence_3189.txt,"The move isn't expected to put SunSoft Inc's nose out of joint, the effort is parallel to SunSoft's unbundling of the Solaris operating system.",nose out of joint,45,17,"[0, 0, 0, 0, 0, 0, 0, 0, 1, 1, 1, 1, 0, 0, 0, 0, 0, 0, 0, 0, 0, 0, 0, 0]"
1286,sentence_319.txt,"It was involved with your trial and error and practice, but it was certainly involved with Vicky and that is watching, or learning from okay.",trial and error,26,15,"[0, 0, 0, 0, 0, 1, 1, 1, 0, 0, 0, 0, 0, 0, 0, 0, 0, 0, 0, 0, 0, 0, 0, 0, 0]"
1287,sentence_3193.txt,Pleased as Punch she is.,Pleased as Punch,0,16,"[1, 1, 1, 0, 0]"
1288,sentence_3197.txt,"I'm sorry,' I said, wondering how I could save face.",save face,42,9,"[0, 0, 0, 0, 0, 0, 0, 0, 1, 1]"
1289,sentence_3198.txt,"It's a curious thing but fans of all persuasions, even in the stubborn North, seem to have a soft spot for Spurs maybe because, for as long as anyone can remember, they have tried to play the game.",a soft spot,91,11,"[0, 0, 0, 0, 0, 0, 0, 0, 0, 0, 0, 0, 0, 0, 0, 0, 0, 1, 1, 1, 0, 0, 0, 0, 0, 0, 0, 0, 0, 0, 0, 0, 0, 0, 0, 0, 0, 0]"
1290,sentence_3199.txt,Your body language will speak volumes about your happy state.,speak volumes,24,13,"[0, 0, 0, 0, 1, 1, 0, 0, 0, 0]"
1291,sentence_32.txt,Trust a woman to make a mountain out of a molehill.,make a mountain out of a molehill,17,33,"[0, 0, 0, 0, 1, 1, 1, 1, 1, 1, 1]"
1292,sentence_320.txt,"This picture of Dreadnought was so wide of the mark that Willis found it better to say nothing, simply making a gesture which had something in common with a petty officer's salute.",wide of the mark,35,16,"[0, 0, 0, 0, 0, 0, 1, 1, 1, 1, 0, 0, 0, 0, 0, 0, 0, 0, 0, 0, 0, 0, 0, 0, 0, 0, 0, 0, 0, 0, 0, 0]"
1293,sentence_3200.txt,The best way to let off steam is with people who love you and don't judge you.,let off steam,16,13,"[0, 0, 0, 0, 1, 1, 1, 0, 0, 0, 0, 0, 0, 0, 0, 0, 0]"
1294,sentence_3201.txt,The only thing that gets me steamed up is when they have a go at you.,steamed up,28,10,"[0, 0, 0, 0, 0, 0, 1, 1, 0, 0, 0, 0, 0, 0, 0, 0]"
1295,sentence_3202.txt,In a stew over OXO tower.,In a stew,0,9,"[1, 1, 1, 0, 0, 0]"
1296,sentence_3206.txt,"The muscles of your larynx, taut with anxiety, cause the sweet nothings to come out in semi-castrato squeak.",sweet nothings,57,14,"[0, 0, 0, 0, 0, 0, 0, 0, 0, 0, 1, 1, 0, 0, 0, 0, 0, 0]"
1297,sentence_3207.txt,"You will wonder no more if you stay here and, if you take a fancy to the bed you sleep in, Signora Silvana, who speaks excellent English, will sell it to you.",take a fancy,53,12,"[0, 0, 0, 0, 0, 0, 0, 0, 0, 0, 0, 0, 1, 1, 1, 0, 0, 0, 0, 0, 0, 0, 0, 0, 0, 0, 0, 0, 0, 0, 0, 0]"
1298,sentence_3212.txt,He was still on tenterhooks waiting for his directors' decision about the manager's job.,on tenterhooks,13,14,"[0, 0, 0, 1, 1, 0, 0, 0, 0, 0, 0, 0, 0, 0]"
1299,sentence_3215.txt,My children think the world of their gerbil.,think the world of,12,18,"[0, 0, 1, 1, 1, 1, 0, 0]"
1300,sentence_3216.txt,This was accompanied by a thinly veiled threat that her retention would cause a serious impediment to the educational efficiency of the school.,thinly veiled,26,13,"[0, 0, 0, 0, 0, 1, 1, 0, 0, 0, 0, 0, 0, 0, 0, 0, 0, 0, 0, 0, 0, 0, 0]"
1301,sentence_3218.txt,"Show me a woman who says Dane Jacobsen doesn't make her go weak at the knees, and I'll show you a liar.",weak at the knees,59,17,"[0, 0, 0, 0, 0, 0, 0, 0, 0, 0, 0, 0, 1, 1, 1, 1, 0, 0, 0, 0, 0, 0]"
1302,sentence_322.txt,Servants bow and scrape.,bow and scrape,9,14,"[0, 1, 1, 1]"
1303,sentence_3223.txt,"Perfect for the postparty come-down spliff up, chill out and get One Dove on them gramophones.",chill out,47,9,"[0, 0, 0, 0, 0, 0, 0, 1, 1, 0, 0, 0, 0, 0, 0, 0]"
1304,sentence_3227.txt,"Rhetorically and strategically, the war was in full swing before crack was identified as the principal enemy.",in full swing,44,13,"[0, 0, 0, 0, 0, 0, 1, 1, 1, 0, 0, 0, 0, 0, 0, 0, 0]"
1305,sentence_323.txt,"Yes, the done thing for driving horses to canter or gallop on the road, they never ever should.",the done thing,5,14,"[0, 1, 1, 1, 0, 0, 0, 0, 0, 0, 0, 0, 0, 0, 0, 0, 0, 0]"
1306,sentence_3234.txt,"Within the limitations imposed by his hosts and his own inhibitions and scruples, the anthropologist has to mix in with local society and become the life and soul of the party.",life and soul of the party,149,26,"[0, 0, 0, 0, 0, 0, 0, 0, 0, 0, 0, 0, 0, 0, 0, 0, 0, 0, 0, 0, 0, 0, 0, 0, 0, 1, 1, 1, 1, 1, 1]"
1307,sentence_3239.txt,I said I was only pulling your leg.,pulling your leg,18,16,"[0, 0, 0, 0, 0, 1, 1, 1]"
1308,sentence_324.txt,"They didn't switch off when he played bloody hell with' em, excuse my French er President, but this is how it went, he couldn't give a damn about you bloody lot, he kept the television on, it just showed his frustration.",excuse my French,60,16,"[0, 0, 0, 0, 0, 0, 0, 0, 0, 0, 0, 1, 1, 1, 0, 0, 0, 0, 0, 0, 0, 0, 0, 0, 0, 0, 0, 0, 0, 0, 0, 0, 0, 0, 0, 0, 0, 0, 0, 0, 0]"
1309,sentence_3240.txt,"This brought forth the usual gales of laughter and requests to pull the other one, stop having them on, etc.",pull the other one,63,18,"[0, 0, 0, 0, 0, 0, 0, 0, 0, 0, 0, 1, 1, 1, 1, 0, 0, 0, 0, 0]"
1310,sentence_3241.txt,"If you make a joke, pause before the punch line.",punch line,37,10,"[0, 0, 0, 0, 0, 0, 0, 0, 1, 1]"
1311,sentence_3245.txt,You'll have to take it easy when you do come out.,take it easy,15,12,"[0, 0, 0, 1, 1, 1, 0, 0, 0, 0, 0]"
1312,sentence_3249.txt,They just want to stay on cloud nine.,on cloud nine,23,13,"[0, 0, 0, 0, 0, 1, 1, 1]"
1313,sentence_325.txt,"Of course, en suite has long been de rigueur, if you'll pardon my French, in hotels nationwide.",pardon my French,56,16,"[0, 0, 0, 0, 0, 0, 0, 0, 0, 0, 0, 1, 1, 1, 0, 0, 0]"
1314,sentence_3252.txt,"A few months ago Hardyman was down in the dumps Sunderland had shelled out 350,000 for another left back, Anton Rogan, and his days at Roker looked numbered.",down in the dumps,30,17,"[0, 0, 0, 0, 0, 0, 1, 1, 1, 1, 0, 0, 0, 0, 0, 0, 0, 0, 0, 0, 0, 0, 0, 0, 0, 0, 0, 0]"
1315,sentence_3253.txt,"His hearty voice was soon familiar to and popular with many thousands of listeners up and down the west coast and he invariably ended his broadcasts with a special Good-Night wish to a different section of the community each evening, such as to June brides, to lighthouse keepers' out there in the dark', or to all dentists who might be' looking down in the mouth'.",down in the mouth,346,17,"[0, 0, 0, 0, 0, 0, 0, 0, 0, 0, 0, 0, 0, 0, 0, 0, 0, 0, 0, 0, 0, 0, 0, 0, 0, 0, 0, 0, 0, 0, 0, 0, 0, 0, 0, 0, 0, 0, 0, 0, 0, 0, 0, 0, 0, 0, 0, 0, 0, 0, 0, 0, 0, 0, 0, 0, 0, 0, 0, 0, 0, 1, 1, 1, 1]"
1316,sentence_3257.txt,He was grinning from ear to ear and the first stabs of doubt needled at Ruth's heart.,grinning from ear to ear,7,24,"[0, 0, 1, 1, 1, 1, 1, 0, 0, 0, 0, 0, 0, 0, 0, 0, 0]"
1317,sentence_326.txt,Perhaps next time you'll inform me first before you gatecrash my party and throw yourself into the fountain.,gatecrash,52,9,"[0, 0, 0, 0, 0, 0, 0, 0, 0, 1, 0, 0, 0, 0, 0, 0, 0, 0]"
1318,sentence_3267.txt,"Never look back, their results speak for themselves.",Never look back,0,15,"[1, 1, 1, 0, 0, 0, 0, 0]"
1319,sentence_3268.txt,They are both over the moon.,over the moon,14,13,"[0, 0, 0, 1, 1, 1]"
1320,sentence_327.txt,So watch your language.,watch your language,3,19,"[0, 1, 1, 1]"
1321,sentence_3272.txt,Gould was in seventh heaven.,in seventh heaven,10,17,"[0, 0, 1, 1, 1]"
1322,sentence_3274.txt,"Oh, yes, absolutely, thrilled to bits.",thrilled to bits,21,16,"[0, 0, 0, 1, 1, 1]"
1323,sentence_3276.txt,"If attending a wedding or party of close friends, you should have the time of your life",have the time of your life,61,26,"[0, 0, 0, 0, 0, 0, 0, 0, 0, 0, 0, 1, 1, 1, 1, 1, 1]"
1324,sentence_3277.txt,Britain was on top of the world.,on top of the world,12,19,"[0, 0, 1, 1, 1, 1, 1]"
1325,sentence_3278.txt,Everything becomes so much easier and some people have an experience akin to walking on air or walking on the moon.,walking on air,77,14,"[0, 0, 0, 0, 0, 0, 0, 0, 0, 0, 0, 0, 0, 1, 1, 1, 0, 0, 0, 0, 0]"
1326,sentence_3281.txt,"Victor will go bananas, and Rachel will think I got laid.",go bananas,12,10,"[0, 0, 1, 1, 0, 0, 0, 0, 0, 0, 0]"
1327,sentence_3288.txt,"In American teen slang, Vini is a space a dreamer, someone not all there.",not all there,59,13,"[0, 0, 0, 0, 0, 0, 0, 0, 0, 0, 0, 1, 1, 1]"
1328,sentence_329.txt,"Don't overstep the mark too far, Mr Calder.",overstep the mark,6,17,"[0, 1, 1, 1, 0, 0, 0, 0]"
1329,sentence_3294.txt,Univac's masters decided the machine had a screw loose.,screw loose,43,11,"[0, 0, 0, 0, 0, 0, 0, 1, 1]"
1330,sentence_33.txt,Is that much ado about nothing really?,much ado about nothing,8,22,"[0, 0, 1, 1, 1, 1, 0]"
1331,sentence_330.txt,Did I speak out of turn?,speak out of turn,6,17,"[0, 0, 1, 1, 1, 1]"
1332,sentence_3301.txt,"But since they were very important people who told the original lies, they couldn't eat humble pie and be seen to change their minds, so we're stuck with the thing until the end of the next century.",eat humble pie,84,14,"[0, 0, 0, 0, 0, 0, 0, 0, 0, 0, 0, 0, 0, 0, 1, 1, 1, 0, 0, 0, 0, 0, 0, 0, 0, 0, 0, 0, 0, 0, 0, 0, 0, 0, 0, 0, 0]"
1333,sentence_3303.txt,How about that for a Freudian slip?,Freudian slip,21,13,"[0, 0, 0, 0, 0, 1, 1]"
1334,sentence_3309.txt,"It could take some trial and error to discover the correct interval, and you may need to chart the person's pattern.",trial and error,19,15,"[0, 0, 0, 0, 1, 1, 1, 0, 0, 0, 0, 0, 0, 0, 0, 0, 0, 0, 0, 0, 0]"
1335,sentence_331.txt,"Come on now, Malachi, don't stand on ceremony here at home.",stand on ceremony,28,17,"[0, 0, 0, 0, 0, 1, 1, 1, 0, 0, 0]"
1336,sentence_3310.txt,"In answer to this, there are cases in which the notion of force feeding is very wide of the mark.",wide of the mark,80,16,"[0, 0, 0, 0, 0, 0, 0, 0, 0, 0, 0, 0, 0, 0, 0, 0, 1, 1, 1, 1]"
1337,sentence_3313.txt,You mean it's all right to sleep with you under your own roof with your mother there although it's not quite the done thing here.,the done thing,109,14,"[0, 0, 0, 0, 0, 0, 0, 0, 0, 0, 0, 0, 0, 0, 0, 0, 0, 0, 0, 0, 0, 1, 1, 1, 0]"
1338,sentence_3316.txt,"Sometimes, a wild orange would appear out of the forest and gatecrash the party.",gatecrash,60,9,"[0, 0, 0, 0, 0, 0, 0, 0, 0, 0, 0, 1, 0, 0]"
1339,sentence_3324.txt,If the PWRs have an Achilles heel it is their steam-generator tubes.,Achilles heel,20,13,"[0, 0, 0, 0, 0, 1, 1, 0, 0, 0, 0, 0]"
1340,sentence_3325.txt,The Chancellor's proposal to add VAT to domestic fuel bills has once again set alarm bells ringing for pensioners and others on low incomes.,alarm bells ringing,79,19,"[0, 0, 0, 0, 0, 0, 0, 0, 0, 0, 0, 0, 0, 0, 1, 1, 1, 0, 0, 0, 0, 0, 0, 0]"
1341,sentence_3326.txt,Trying to interrogate officers of the Grand Army would have been asking for trouble.,asking for trouble,65,18,"[0, 0, 0, 0, 0, 0, 0, 0, 0, 0, 0, 1, 1, 1]"
1342,sentence_3327.txt,"The light showed dozens of them, all the way back to the wall.",back to the wall,45,16,"[0, 0, 0, 0, 0, 0, 0, 0, 0, 1, 1, 1, 1]"
1343,sentence_3331.txt,The thing was on the blink again.,on the blink,14,12,"[0, 0, 0, 1, 1, 1, 0]"
1344,sentence_3333.txt,It seems that we've opened a real can of worms with these Dixon complaints.,can of worms,34,12,"[0, 0, 0, 0, 0, 0, 0, 1, 1, 1, 0, 0, 0, 0]"
1345,sentence_3334.txt,"It not take him long to realize that if the police wanted someone to carry the can, then Dirk Coetzee was heading for death row.",carry the can,69,13,"[0, 0, 0, 0, 0, 0, 0, 0, 0, 0, 0, 0, 0, 0, 1, 1, 1, 0, 0, 0, 0, 0, 0, 0, 0]"
1346,sentence_3335.txt,Again there is nothing catch 22 about this.,catch 22,23,8,"[0, 0, 0, 0, 1, 1, 0, 0]"
1347,sentence_3336.txt,The walls seem to meet overhead to block out the sky and a chill wind blows as we approach the impasse at the head of the gully.,chill wind,59,10,"[0, 0, 0, 0, 0, 0, 0, 0, 0, 0, 0, 0, 0, 1, 1, 0, 0, 0, 0, 0, 0, 0, 0, 0, 0, 0, 0]"
1348,sentence_3339.txt,"Puddin's on't table, lads at 5.30 come hell or high water.",come hell or high water,34,23,"[0, 0, 0, 0, 0, 0, 1, 1, 1, 1, 1]"
1349,sentence_334.txt,"So they find your particular weakness, your Achilles heel and they'd go for that.",Achilles heel,44,13,"[0, 0, 0, 0, 0, 0, 0, 1, 1, 0, 0, 0, 0, 0]"
1350,sentence_3341.txt,We all have our cross to bear' has become a modern-day expression.,cross to bear,16,13,"[0, 0, 0, 0, 1, 1, 1, 0, 0, 0, 0, 0]"
1351,sentence_3343.txt,All those vital issues are to be rigidly centralised and that is the crux of the matter.,crux of the matter,69,18,"[0, 0, 0, 0, 0, 0, 0, 0, 0, 0, 0, 0, 0, 1, 1, 1, 1]"
1352,sentence_3348.txt,I knew Purvis would get to the bottom of it in time.,get to the bottom of,20,20,"[0, 0, 0, 0, 1, 1, 1, 1, 1, 0, 0, 0]"
1353,sentence_335.txt,The government takes the view that President Clinton was simply addressing domestic critics of his foreign policy and that his complaints shouldn't set the alarm bells ringing.,alarm bells ringing,156,19,"[0, 0, 0, 0, 0, 0, 0, 0, 0, 0, 0, 0, 0, 0, 0, 0, 0, 0, 0, 0, 0, 0, 0, 0, 1, 1, 1]"
1354,sentence_3352.txt,"When the going gets tough with your studies, having goals will help to see you through.",When the going gets tough,0,25,"[1, 1, 1, 1, 1, 0, 0, 0, 0, 0, 0, 0, 0, 0, 0, 0]"
1355,sentence_3355.txt,It was a couple of weeks before and I was left high and dry without a partner.,high and dry,47,12,"[0, 0, 0, 0, 0, 0, 0, 0, 0, 0, 0, 1, 1, 1, 0, 0, 0]"
1356,sentence_3357.txt,She couldn't just leave Steve in the lurch after all they had done to get the business together.,in the lurch,30,12,"[0, 0, 0, 0, 0, 1, 1, 1, 0, 0, 0, 0, 0, 0, 0, 0, 0, 0]"
1357,sentence_336.txt,Or an electric fire then you would be asking for trouble because you'd be trying to draw out.,asking for trouble,38,18,"[0, 0, 0, 0, 0, 0, 0, 0, 1, 1, 1, 0, 0, 0, 0, 0, 0, 0]"
1358,sentence_3360.txt,As a last resort you can call out the total number of those present.,last resort,5,11,"[0, 0, 1, 1, 0, 0, 0, 0, 0, 0, 0, 0, 0, 0]"
1359,sentence_3363.txt,"First, must it be murder?",be murder,15,9,"[0, 0, 0, 1, 1]"
1360,sentence_3364.txt,The need for exports is too often regarded by Yugoslav enterprises as a' necessary evil' imposed on them by the government.,necessary evil,73,14,"[0, 0, 0, 0, 0, 0, 0, 0, 0, 0, 0, 0, 0, 1, 1, 0, 0, 0, 0, 0, 0]"
1361,sentence_3367.txt,"With this Demon you'll lose loadsa Fuzzies, so you must get out of sync as soon as possible.",out of sync,60,11,"[0, 0, 0, 0, 0, 0, 0, 0, 0, 0, 0, 1, 1, 1, 0, 0, 0, 0]"
1362,sentence_337.txt,Someone came out of The Two Pheasants and latched the door back to the wall hospitably.,back to the wall,59,16,"[0, 0, 0, 0, 0, 0, 0, 0, 0, 0, 0, 1, 1, 1, 1, 0]"
1363,sentence_3370.txt,"Isn't it easier to pass the buck to your boss, some staff person or a committee?",pass the buck,19,13,"[0, 0, 0, 0, 1, 1, 1, 0, 0, 0, 0, 0, 0, 0, 0, 0]"
1364,sentence_3372.txt,"It must never be used as a quick fix, but only as part of a dedicated care programme.",quick fix,27,9,"[0, 0, 0, 0, 0, 0, 0, 1, 1, 0, 0, 0, 0, 0, 0, 0, 0, 0]"
1365,sentence_3373.txt,"In spite of recent emotional dramas or conflicts, you must put on a brave face and allow others to share your load.",put on a brave face,59,19,"[0, 0, 0, 0, 0, 0, 0, 0, 0, 0, 1, 1, 1, 1, 1, 0, 0, 0, 0, 0, 0, 0]"
1366,sentence_3375.txt,The Bill will barely scratch the surface of either problem.,scratch the surface,21,19,"[0, 0, 0, 0, 1, 1, 1, 0, 0, 0]"
1367,sentence_3378.txt,"If an employee decides to accept the transfer as a result of a counselling session which gave a misleading impression, it can only spell trouble for his or her future happiness in the job.",spell trouble,131,13,"[0, 0, 0, 0, 0, 0, 0, 0, 0, 0, 0, 0, 0, 0, 0, 0, 0, 0, 0, 0, 0, 0, 0, 1, 1, 0, 0, 0, 0, 0, 0, 0, 0, 0]"
1368,sentence_338.txt,At which point she unlocked her ball and chain.,ball and chain,32,14,"[0, 0, 0, 0, 0, 0, 1, 1, 1]"
1369,sentence_3383.txt,Defence cuts could also be a stumbling block.,stumbling block,29,15,"[0, 0, 0, 0, 0, 0, 1, 1]"
1370,sentence_3385.txt,Not surprisingly they take the easy way out when food is put out for them each day.,take the easy way out,22,21,"[0, 0, 0, 1, 1, 1, 1, 1, 0, 0, 0, 0, 0, 0, 0, 0, 0]"
1371,sentence_3387.txt,But there are more than a few teething problems.,teething problems,30,17,"[0, 0, 0, 0, 0, 0, 0, 1, 1]"
1372,sentence_3388.txt,"In addition, sending encrypted data over international boundaries represents a thorny issue, it is still illegal in some countries.",thorny issue,79,12,"[0, 0, 0, 0, 0, 0, 0, 0, 0, 0, 1, 1, 0, 0, 0, 0, 0, 0, 0]"
1373,sentence_339.txt,They are the bane of my life.,bane of my life,13,15,"[0, 0, 0, 1, 1, 1, 1]"
1374,sentence_3392.txt,You come out of a tight spot smelling of roses.,tight spot,18,10,"[0, 0, 0, 0, 0, 1, 1, 0, 0, 0]"
1375,sentence_3393.txt,But Dr Mackie said the report showed only the tip of the iceberg as many incidents went unreported.,tip of the iceberg,46,18,"[0, 0, 0, 0, 0, 0, 0, 0, 0, 1, 1, 1, 1, 0, 0, 0, 0, 0]"
1376,sentence_3396.txt,"For Africa, meanwhile, the 1980s have been an almost unmitigated disaster.",unmitigated disaster,53,20,"[0, 0, 0, 0, 0, 0, 0, 0, 0, 1, 1]"
1377,sentence_3397.txt,"You have to recruit the best, even if it means fighting an uphill battle to get personnel policies changed, to persuade your boss to pay your people.",uphill battle,59,13,"[0, 0, 0, 0, 0, 0, 0, 0, 0, 0, 0, 0, 1, 1, 0, 0, 0, 0, 0, 0, 0, 0, 0, 0, 0, 0, 0]"
1378,sentence_3398.txt,It's a vicious circle.,vicious circle,7,14,"[0, 0, 1, 1]"
